{
    "$schema": "http://json-schema.org/draft-07/schema#",
    "title": "CBSE English Questions Schema",
    "type": "array",
    "items": {
      "type": "object",
      "required": [
        "question",
        "subject",
        "chapter",
        "marks",
        "question_type",
        "is_repeated",
        "board",
        "keywords",
        "subquestions"
      ],
      "properties": {
        "question": {
          "type": "string",
          "description": "Full question text, possibly prefixed with 'extract:'"
        },
        "subject": {
          "type": "string"
        },
        "chapter": {
          "type": "string"
        },
        "year": {
          "type": ["string", "null"],
          "description": "Year when asked, if available"
        },
        "marks": {
          "type": "integer",
          "minimum": 0
        },
        "question_type": {
          "type": "string",
          "enum": [
            "extract-based",
            "very short answer",
            "short answer",
            "long answer"
          ]
        },
        "is_repeated": {
          "type": "boolean"
        },
        "asked_in_years": {
          "type": ["array", "null"],
          "items": { "type": ["string", "integer"] },
          "description": "List of years when repeated, if any"
        },
        "solution": {
          "type": ["string", "null"]
        },
        "board": {
          "type": "string"
        },
        "keywords": {
          "type": "array",
          "items": { "type": "string" }
        },
        "subquestions": {
          "type": "array",
          "items": {
            "type": "object",
            "required": [
              "text",
              "marks",
              "question_type",
              "keywords"
            ],
            "properties": {
              "text": { "type": "string" },
              "marks": { "type": "integer", "minimum": 0 },
              "question_type": { "type": "string" },
              "keywords": {
                "type": "array",
                "items": { "type": "string" }
              },
              "solution": { "type": ["string", "null"] }
            },
            "additionalProperties": false
          }
        }
      },
      "additionalProperties": false
    }
  }
  