[
  {
    "question": "extract: let me put this more clearly, since no one will believe that a thirteen-year old girl is completely alone in this world. and i'm not. i have loving parents and a sixteen years old sister, and there are almost thirty people i can call friends. i have a family, loving aunts and a good house. no, on the surface i seem to have everything, except my one true friend. all i think about when i am with friends is having a good time. i can't bring myself to talk about anything, but ordinary everyday things.",
    "subject": "english",
    "chapter": "from the diary of anne frank",
    "year": "test",
    "marks": 5,
    "question_type": "extract-based",
    "is_repeated": false,
    "asked_in_years": "test",
    "solution": "test",
    "board": "cbse",
    "keywords": ["anne frank", "loneliness", "friends", "extract-based"],
    "subquestions": [
      {
        "text": "on the surface, it appears that anne the thirteen year old girl",
        "marks": 1,
        "question_type": "very short answer",
        "keywords": ["anne frank", "appearance", "loneliness"],
        "solution": "test"
      },
      {
        "text": "how can we infer that the speaker felt alone in the world? (a) she had a family of many people. (b) she had loving parents. (c) she had thirty friends. (d) she craves for a true friend.",
        "marks": 1,
        "question_type": "very short answer",
        "keywords": ["anne frank", "loneliness", "true friend"],
        "solution": "test"
      },
      {
        "text": "anne and her friends talked about (a) their problematic parents (b) their financial problems (c) common everyday things (d) the commuting problems",
        "marks": 1,
        "question_type": "very short answer",
        "keywords": ["anne frank", "conversation", "everyday things"],
        "solution": "test"
      },
      {
        "text": "complete the analogy by selecting the suitable word from the text: alone : friends :: nothing :",
        "marks": 1,
        "question_type": "very short answer",
        "keywords": ["anne frank", "analogy", "loneliness"],
        "solution": "test"
      },
      {
        "text": "select the option that correctly captures the usage of the idiom 'bring myself' from the extract: (a) to do something willingly (b) to do something unwillingly (c) a charitable act (d) an involuntary act",
        "marks": 1,
        "question_type": "very short answer",
        "keywords": ["anne frank", "idiom", "bring myself"],
        "solution": "test"
      }
    ]
  },
  {
    "question": "extract: mrs. hall almost fell down the stairs in hysterics. she was convinced that the room was haunted by spirits and that the stranger had somehow caused these to enter into her furniture.",
    "subject": "english",
    "chapter": "footprints without feet",
    "year": "test",
    "marks": 5,
    "question_type": "extract-based",
    "is_repeated": false,
    "asked_in_years": "test",
    "solution": "test",
    "board": "cbse",
    "keywords": ["mrs. hall", "spirits", "stranger", "extract-based"],
    "subquestions": [
      {
        "text": "mrs. hall tripped because (a) the floor was oily. (b) she was standing on a chair. (c) she was in a state of panic. (d) the door was slammed.",
        "marks": 1,
        "question_type": "very short answer",
        "keywords": ["mrs. hall", "panic", "spirits"],
        "solution": "test"
      },
      {
        "text": "mrs. hall suspected everything in the room was put under a spell of witchcraft by",
        "marks": 1,
        "question_type": "very short answer",
        "keywords": ["mrs. hall", "witchcraft", "stranger"],
        "solution": "test"
      },
      {
        "text": "fill in the blank with one word only: mrs. hall was afraid that spirits had entered",
        "marks": 1,
        "question_type": "very short answer",
        "keywords": ["mrs. hall", "spirits", "furniture"],
        "solution": "test"
      },
      {
        "text": "according to the extract, the feeling of mrs. hall can be best described as (1) stunned (2) happy (3) awestruck (4) nervous (5) outraged (6) agitated select the correct option: (a) (2) and (4) (b) (3) and (6) (c) (5) and (6) (d) (1) and (6)",
        "marks": 1,
        "question_type": "very short answer",
        "keywords": ["mrs. hall", "feelings", "panic"],
        "solution": "test"
      },
      {
        "text": "'spirits' in the above lines means the same as (a) ghosts (b) conscience (c) ego (d) attitude",
        "marks": 1,
        "question_type": "very short answer",
        "keywords": ["mrs. hall", "spirits", "ghosts"],
        "solution": "test"
      }
    ]
  },
  {
    "question": "extract: though to distinguish beasts of prey a novice might nonplus, the crocodiles you always may tell from the hyena thus: hyenas come with merry smiles; but if they weep they're crocodiles.",
    "subject": "english",
    "chapter": "how to tell wild animals",
    "year": "test",
    "marks": 5,
    "question_type": "extract-based",
    "is_repeated": false,
    "asked_in_years": "test",
    "solution": "test",
    "board": "cbse",
    "keywords": ["crocodiles", "hyenas", "animals", "extract-based"],
    "subquestions": [
      {
        "text": "select the appropriate option to complete the sentence, according to the extract: crocodiles can be identified by their (a) tears (b) attitude (c) smiles (d) attacks",
        "marks": 1,
        "question_type": "very short answer",
        "keywords": ["crocodiles", "hyenas", "identification"],
        "solution": "test"
      },
      {
        "text": "state whether the following statement is true or false: hyenas are famous for weeping.",
        "marks": 1,
        "question_type": "very short answer",
        "keywords": ["hyenas", "weeping", "crocodiles"],
        "solution": "test"
      },
      {
        "text": "'novice' in line 2 means the same as: (a) learner (b) beast (c) tender foot (d) beginner",
        "marks": 1,
        "question_type": "very short answer",
        "keywords": ["novice", "meaning", "beginner"],
        "solution": "test"
      },
      {
        "text": "in this extract the poet has presented two different behavioural traits of animals. they are",
        "marks": 1,
        "question_type": "very short answer",
        "keywords": ["crocodiles", "hyenas", "behavioural traits"],
        "solution": "test"
      },
      {
        "text": "the poet uses 'a novice might nonplus' instead of the novice might get confused. how does this usage impact the poem? (a) adds an incorrect option. (b) it is associated with beasts. (c) it rhymes and adds humour. (d) it simplifies the meaning.",
        "marks": 1,
        "question_type": "very short answer",
        "keywords": ["novice", "nonplus", "humour"],
        "solution": "test"
      }
    ]
  },
  {
    "question": "extract: he stalks in his vivid stripes the few steps of his cage, on pads of velvet quiet, in his quiet rage he should be lurking in shadow sliding through long grass near the water hole where plump deer pass.",
    "subject": "english",
    "chapter": "a tiger in the zoo",
    "year": "test",
    "marks": 5,
    "question_type": "extract-based",
    "is_repeated": false,
    "asked_in_years": "test",
    "solution": "test",
    "board": "cbse",
    "keywords": ["tiger", "cage", "freedom", "extract-based"],
    "subquestions": [
      {
        "text": "complete the sentence appropriately. the vivid stripes refer to the",
        "marks": 1,
        "question_type": "very short answer",
        "keywords": ["tiger", "vivid stripes", "cage"],
        "solution": "test"
      },
      {
        "text": "which word from the extract is the opposite of 'loud'?",
        "marks": 1,
        "question_type": "very short answer",
        "keywords": ["tiger", "opposite", "loud"],
        "solution": "test"
      },
      {
        "text": "the use of the phrase 'pads of velvet' means (a) neck (b) tail (c) skin (d) paws",
        "marks": 1,
        "question_type": "very short answer",
        "keywords": ["tiger", "pads of velvet", "paws"],
        "solution": "test"
      },
      {
        "text": "state whether the following statement is true or false: the confinement of the cramped space of the cage has restricted the tiger's steps.",
        "marks": 1,
        "question_type": "very short answer",
        "keywords": ["tiger", "cage", "confinement"],
        "solution": "test"
      },
      {
        "text": "the tiger was lurking in shadow (a) to catch its prey (b) as the cage was dark (c) as the velvet was quiet (d) as he was in a rage",
        "marks": 1,
        "question_type": "very short answer",
        "keywords": ["tiger", "lurking", "prey"],
        "solution": "test"
      }
    ]
  },
  {
    "question": "extract: tenth may dawned bright and clear. for the past few days, i had been pleasantly besieged by dignitaries and world leaders who were coming to pay their respects before the inauguration. the inauguration would be the largest gathering ever of international leaders on south african soil. the ceremonies took place in the lovely sandstone amphitheatre formed by the union buildings in pretoria. for decades this had been the seat of white supremacy, and now it was the site of rainbow gathering of different colours and nations for the installation of south africa's first democratic nonracial government.",
    "subject": "english",
    "chapter": "nelson mandela: long walk to freedom",
    "year": "test",
    "marks": 5,
    "question_type": "extract-based",
    "is_repeated": false,
    "asked_in_years": "test",
    "solution": "test",
    "board": "cbse",
    "keywords": ["nelson mandela", "inauguration", "rainbow gathering", "extract-based"],
    "subquestions": [
      {